{
  "meta": {
    "generatedAt": "2024-10-27T14:30:00Z",
    "scheduleCount": 1
  },
  "scheduleExecution": {
    "description": "Sub-audit execution coverage per schedule — current and up to 3 previous. Each entry shows how many sub-audits were executed vs not executed.",
    "items": [
      {
        "scheduleId": "SCH-2024-10",
        "label": "Current",
        "isCurrent": true,
        "total": 150,
        "executed": 100,
        "notExecuted": 50,
        "coveragePercent": 66.7,
        "performanceFlag": "Below Target"
      }
    ]
  },
  "subAuditTypeExecution": {
    "description": "Sub-audit type execution breakdown for the current schedule (SCH-2024-10). Sorted by execution percent ascending — lowest-performing types appear first.",
    "currentScheduleId": "SCH-2024-10",
    "items": [
      {
        "subAuditName": "Data Privacy Audit",
        "executed": 10,
        "notExecuted": 15,
        "total": 25,
        "executionPercent": 40
      },
      {
        "subAuditName": "Regulatory Compliance",
        "executed": 12,
        "notExecuted": 18,
        "total": 30,
        "executionPercent": 40
      },
      {
        "subAuditName": "Operational Efficiency",
        "executed": 20,
        "notExecuted": 10,
        "total": 30,
        "executionPercent": 66.7
      },
      {
        "subAuditName": "Financial Reporting",
        "executed": 25,
        "notExecuted": 5,
        "total": 30,
        "executionPercent": 83.3
      },
      {
        "subAuditName": "IT Security Review",
        "executed": 33,
        "notExecuted": 2,
        "total": 35,
        "executionPercent": 94.3
      }
    ]
  },
  "executionTrend": {
    "classification": "Stable",
    "currentCoveragePercent": 66.7,
    "previousAvgCoveragePercent": 66.7,
    "coverageChangePct": 0
  }
}