{
  "meta": {
    "generatedAt": "2024-07-20T10:00:00Z",
    "scheduleCount": 1
  },
  "scheduleExecution": {
    "description": "Sub-audit execution coverage per schedule — current and up to 3 previous. Each entry shows how many sub-audits were executed vs not executed.",
    "items": [
      {
        "scheduleId": "SCH-2024-07",
        "label": "Current",
        "isCurrent": true,
        "total": 150,
        "executed": 110,
        "notExecuted": 40,
        "coveragePercent": 73.3,
        "performanceFlag": "Below Target"
      }
    ]
  },
  "subAuditTypeExecution": {
    "description": "Sub-audit type execution breakdown for the current schedule (SCH-2024-07). Sorted by execution percent ascending — lowest-performing types appear first.",
    "currentScheduleId": "SCH-2024-07",
    "items": [
      {
        "subAuditName": "Financial Audit",
        "executed": 20,
        "notExecuted": 15,
        "total": 35,
        "executionPercent": 57.1
      },
      {
        "subAuditName": "IT Security Audit",
        "executed": 25,
        "notExecuted": 10,
        "total": 35,
        "executionPercent": 71.4
      },
      {
        "subAuditName": "Compliance Review",
        "executed": 30,
        "notExecuted": 10,
        "total": 40,
        "executionPercent": 75
      },
      {
        "subAuditName": "Process Review",
        "executed": 35,
        "notExecuted": 5,
        "total": 40,
        "executionPercent": 87.5
      }
    ]
  },
  "executionTrend": {
    "classification": "Stable",
    "currentCoveragePercent": 73.3,
    "previousAvgCoveragePercent": 73.3,
    "coverageChangePct": 0
  }
}